{
  "artifactRefs": [
    {
      "archetypeId": "primary-document",
      "artifactId": "whitepaper"
    },
    {
      "archetypeId": "appendix",
      "artifactId": "methodology_appendix"
    },
    {
      "archetypeId": "ledger",
      "artifactId": "source_ledger"
    },
    {
      "archetypeId": "risk-gap-report",
      "artifactId": "data_gap_list"
    }
  ],
  "capabilityBindings": [
    {
      "capabilityIds": [
        "capability-preflight",
        "material-activation",
        "multimodal-normalizer"
      ],
      "operationMode": "material_activation"
    },
    {
      "capabilityIds": [
        "scene-router",
        "scene-composer",
        "chapter-planning-expansion",
        "project-control"
      ],
      "operationMode": "project_planning"
    },
    {
      "capabilityIds": [
        "chapter-planning-expansion",
        "source-ledger-claim-graph",
        "voice-profile-humanizer",
        "project-control"
      ],
      "operationMode": "chapter_generation"
    },
    {
      "capabilityIds": [
        "continuation-recovery",
        "entity-timeline-continuity",
        "project-control"
      ],
      "operationMode": "continuation"
    },
    {
      "capabilityIds": [
        "scope-lock-diff",
        "entity-timeline-continuity"
      ],
      "operationMode": "bounded_revision"
    },
    {
      "capabilityIds": [
        "review-revise-quality-loop",
        "rights-privacy-consent",
        "research-verification",
        "transcription-adjudication",
        "review-briefing"
      ],
      "operationMode": "review_quality"
    },
    {
      "capabilityIds": [
        "review-revise-quality-loop",
        "multi-format-rendering",
        "review-briefing",
        "project-control"
      ],
      "operationMode": "finished_draft_closure"
    },
    {
      "capabilityIds": [
        "multi-format-rendering",
        "rights-privacy-consent",
        "artifact-derivation"
      ],
      "operationMode": "export_delivery"
    },
    {
      "capabilityIds": [
        "asset-repurposing",
        "media-illustration-planning",
        "artifact-derivation"
      ],
      "operationMode": "asset_repurposing"
    },
    {
      "capabilityIds": [
        "capability-preflight",
        "source-transcription",
        "multimodal-normalizer"
      ],
      "operationMode": "source_transcription"
    }
  ],
  "contentRiskClass": "medium",
  "displayName": "白皮书与行业研究",
  "domainObjects": [
    "market_fact",
    "method",
    "recommendation",
    "research_scope",
    "scenario"
  ],
  "fallback": {
    "allowGeneralSubstitution": false,
    "connectorUnavailableBehavior": "preserve_route_and_use_local_workflow",
    "localOfflineAvailable": true,
    "riskFloor": "medium"
  },
  "family": "knowledge_publishing",
  "fixtureRefs": [
    "evals/fixtures/scenes/whitepaper-research/normal.json",
    "evals/fixtures/scenes/whitepaper-research/missing.json",
    "evals/fixtures/scenes/whitepaper-research/conflicting.json",
    "evals/fixtures/scenes/whitepaper-research/unauthorized.json",
    "evals/fixtures/scenes/whitepaper-research/adversarial.json",
    "evals/fixtures/scenes/whitepaper-research/connector-unavailable.json"
  ],
  "implementationCheckpoint": "C13",
  "kind": "vertical_scene",
  "legacyAliases": [
    "whitepaper"
  ],
  "lifecycle": "implemented",
  "migrationProvenance": {
    "mappingVersion": "1.0.0",
    "seedCatalogSha256": "638f3f8e8f3ab7f1c2080018233ef6d7e19340187926571aad2eaf818eca82f4"
  },
  "operationModes": [
    "material_activation",
    "project_planning",
    "chapter_generation",
    "continuation",
    "bounded_revision",
    "review_quality",
    "finished_draft_closure",
    "export_delivery",
    "asset_repurposing",
    "source_transcription"
  ],
  "optionalPortBindings": [
    {
      "approvalRequired": true,
      "fallback": "local_workflow_without_connector",
      "legacyLabel": "research_task_board",
      "minimumDataScope": "scene_scoped_minimum",
      "operation": "create_task",
      "portId": "CollaborationPort",
      "purpose": "optional enhancement for research_task_board",
      "readbackRequired": true,
      "required": false,
      "writeMode": "external_write"
    },
    {
      "approvalRequired": true,
      "fallback": "local_workflow_without_connector",
      "legacyLabel": "source_collection",
      "minimumDataScope": "scene_scoped_minimum",
      "operation": "append_intake_submission",
      "portId": "StructuredIntakePort",
      "purpose": "optional enhancement for source_collection",
      "readbackRequired": true,
      "required": false,
      "writeMode": "external_write"
    },
    {
      "approvalRequired": true,
      "fallback": "local_workflow_without_connector",
      "legacyLabel": "review_workflow",
      "minimumDataScope": "scene_scoped_minimum",
      "operation": "request_review",
      "portId": "ReviewPort",
      "purpose": "optional enhancement for review_workflow",
      "readbackRequired": true,
      "required": false,
      "writeMode": "external_write"
    }
  ],
  "privacy": {
    "livingPersonReview": false,
    "minimumDataScope": "claim_and_source_scoped_minimum"
  },
  "qualityGateRefs": [
    {
      "humanOwner": null,
      "parameterProfile": "seed.freshness",
      "registryId": "source.freshness",
      "reviewMandate": null,
      "seedGate": "freshness"
    },
    {
      "humanOwner": null,
      "parameterProfile": "seed.source-quality",
      "registryId": "source.quality",
      "reviewMandate": null,
      "seedGate": "source_quality"
    },
    {
      "humanOwner": null,
      "parameterProfile": "seed.fact-inference-separation",
      "registryId": "claim.fact-inference-separation",
      "reviewMandate": null,
      "seedGate": "fact_inference_separation"
    },
    {
      "humanOwner": null,
      "parameterProfile": "seed.recommendation-strength",
      "registryId": "risk.disclosure",
      "reviewMandate": null,
      "seedGate": "recommendation_strength"
    },
    {
      "humanOwner": null,
      "parameterProfile": "core.default",
      "registryId": "schema.valid",
      "reviewMandate": null,
      "seedGate": "core:schema.valid"
    },
    {
      "humanOwner": null,
      "parameterProfile": "core.default",
      "registryId": "input.required",
      "reviewMandate": null,
      "seedGate": "core:input.required"
    },
    {
      "humanOwner": null,
      "parameterProfile": "core.default",
      "registryId": "artifact.openability",
      "reviewMandate": null,
      "seedGate": "core:artifact.openability"
    },
    {
      "humanOwner": null,
      "parameterProfile": "core.default",
      "registryId": "delivery-manifest.integrity",
      "reviewMandate": null,
      "seedGate": "core:delivery-manifest.integrity"
    },
    {
      "humanOwner": null,
      "parameterProfile": "core.default",
      "registryId": "scope.lock",
      "reviewMandate": null,
      "seedGate": "core:scope.lock"
    },
    {
      "humanOwner": null,
      "parameterProfile": "core.default",
      "registryId": "external-action.authorized",
      "reviewMandate": null,
      "seedGate": "core:external-action.authorized"
    },
    {
      "humanOwner": null,
      "parameterProfile": "core.default",
      "registryId": "encoding.valid",
      "reviewMandate": null,
      "seedGate": "core:encoding.valid"
    }
  ],
  "requiredInputs": [
    {
      "id": "audience",
      "required": true,
      "sensitivity": "standard"
    },
    {
      "id": "claim_boundary",
      "required": true,
      "sensitivity": "standard"
    },
    {
      "id": "goal",
      "required": true,
      "sensitivity": "standard"
    },
    {
      "id": "materials",
      "required": true,
      "sensitivity": "user_provided"
    },
    {
      "id": "metric_definitions",
      "required": true,
      "sensitivity": "standard"
    },
    {
      "id": "research_scope",
      "required": true,
      "sensitivity": "standard"
    }
  ],
  "rights": {
    "clearanceRequired": false,
    "unknownRightsAction": "warn"
  },
  "sceneId": "whitepaper-research",
  "schemaVersion": "1.0.0",
  "triggers": [
    {
      "id": "whitepaper-research-trigger-1",
      "signal": "industry whitepaper",
      "weight": 1
    },
    {
      "id": "whitepaper-research-trigger-2",
      "signal": "research report",
      "weight": 0.9
    },
    {
      "id": "whitepaper-research-trigger-3",
      "signal": "白皮书行业研究",
      "weight": 0.8
    }
  ],
  "workflowStages": [
    {
      "exitGateRefs": [
        "input.required"
      ],
      "id": "activate-materials",
      "operationModes": [
        "material_activation"
      ]
    },
    {
      "exitGateRefs": [
        "input.required",
        "schema.valid"
      ],
      "id": "transcribe-source",
      "operationModes": [
        "source_transcription"
      ]
    },
    {
      "exitGateRefs": [
        "schema.valid"
      ],
      "id": "plan-project",
      "operationModes": [
        "project_planning"
      ]
    },
    {
      "exitGateRefs": [
        "artifact.openability",
        "claim.fact-inference-separation"
      ],
      "id": "draft-and-revise",
      "operationModes": [
        "chapter_generation",
        "continuation",
        "bounded_revision"
      ]
    },
    {
      "exitGateRefs": [
        "artifact.openability",
        "claim.fact-inference-separation",
        "delivery-manifest.integrity",
        "encoding.valid",
        "external-action.authorized",
        "input.required",
        "risk.disclosure",
        "schema.valid",
        "scope.lock",
        "source.freshness",
        "source.quality"
      ],
      "id": "review-and-close",
      "operationModes": [
        "review_quality",
        "finished_draft_closure",
        "export_delivery",
        "asset_repurposing"
      ]
    }
  ]
}
