{
  "artifactRefs": [
    {
      "archetypeId": "primary-document",
      "artifactId": "academic_manuscript"
    },
    {
      "archetypeId": "matrix",
      "artifactId": "literature_matrix"
    },
    {
      "archetypeId": "structured-index",
      "artifactId": "reference_list"
    },
    {
      "archetypeId": "risk-gap-report",
      "artifactId": "limitations"
    }
  ],
  "capabilityBindings": [
    {
      "capabilityIds": [
        "capability-preflight",
        "material-activation",
        "multimodal-normalizer"
      ],
      "operationMode": "material_activation"
    },
    {
      "capabilityIds": [
        "scene-router",
        "scene-composer",
        "chapter-planning-expansion",
        "project-control"
      ],
      "operationMode": "project_planning"
    },
    {
      "capabilityIds": [
        "chapter-planning-expansion",
        "source-ledger-claim-graph",
        "voice-profile-humanizer",
        "project-control"
      ],
      "operationMode": "chapter_generation"
    },
    {
      "capabilityIds": [
        "continuation-recovery",
        "entity-timeline-continuity",
        "project-control"
      ],
      "operationMode": "continuation"
    },
    {
      "capabilityIds": [
        "scope-lock-diff",
        "entity-timeline-continuity"
      ],
      "operationMode": "bounded_revision"
    },
    {
      "capabilityIds": [
        "review-revise-quality-loop",
        "rights-privacy-consent",
        "research-verification",
        "transcription-adjudication",
        "review-briefing"
      ],
      "operationMode": "review_quality"
    },
    {
      "capabilityIds": [
        "review-revise-quality-loop",
        "multi-format-rendering",
        "review-briefing",
        "project-control"
      ],
      "operationMode": "finished_draft_closure"
    },
    {
      "capabilityIds": [
        "multi-format-rendering",
        "rights-privacy-consent",
        "artifact-derivation"
      ],
      "operationMode": "export_delivery"
    },
    {
      "capabilityIds": [
        "asset-repurposing",
        "media-illustration-planning",
        "artifact-derivation"
      ],
      "operationMode": "asset_repurposing"
    },
    {
      "capabilityIds": [
        "capability-preflight",
        "source-transcription",
        "multimodal-normalizer"
      ],
      "operationMode": "source_transcription"
    }
  ],
  "contentRiskClass": "high",
  "displayName": "学术专著与文献综述",
  "domainObjects": [
    "citation",
    "limitation",
    "literature",
    "method",
    "research_question"
  ],
  "fallback": {
    "allowGeneralSubstitution": false,
    "connectorUnavailableBehavior": "preserve_route_and_use_local_workflow",
    "localOfflineAvailable": true,
    "riskFloor": "high"
  },
  "family": "knowledge_publishing",
  "fixtureRefs": [
    "evals/fixtures/scenes/academic-monograph/normal.json",
    "evals/fixtures/scenes/academic-monograph/missing.json",
    "evals/fixtures/scenes/academic-monograph/conflicting.json",
    "evals/fixtures/scenes/academic-monograph/unauthorized.json",
    "evals/fixtures/scenes/academic-monograph/adversarial.json",
    "evals/fixtures/scenes/academic-monograph/connector-unavailable.json"
  ],
  "implementationCheckpoint": "C13",
  "kind": "vertical_scene",
  "legacyAliases": [],
  "lifecycle": "implemented",
  "migrationProvenance": {
    "mappingVersion": "1.0.0",
    "seedCatalogSha256": "638f3f8e8f3ab7f1c2080018233ef6d7e19340187926571aad2eaf818eca82f4"
  },
  "operationModes": [
    "material_activation",
    "project_planning",
    "chapter_generation",
    "continuation",
    "bounded_revision",
    "review_quality",
    "finished_draft_closure",
    "export_delivery",
    "asset_repurposing",
    "source_transcription"
  ],
  "optionalPortBindings": [
    {
      "approvalRequired": true,
      "fallback": "local_workflow_without_connector",
      "legacyLabel": "research_material_archive",
      "minimumDataScope": "scene_scoped_minimum",
      "operation": "store_artifact",
      "portId": "DeliveryPort",
      "purpose": "optional enhancement for research_material_archive",
      "readbackRequired": true,
      "required": false,
      "writeMode": "external_write"
    },
    {
      "approvalRequired": true,
      "fallback": "local_workflow_without_connector",
      "legacyLabel": "peer_review_tasks",
      "minimumDataScope": "scene_scoped_minimum",
      "operation": "request_review",
      "portId": "ReviewPort",
      "purpose": "optional enhancement for peer_review_tasks",
      "readbackRequired": true,
      "required": false,
      "writeMode": "external_write"
    }
  ],
  "privacy": {
    "livingPersonReview": false,
    "minimumDataScope": "claim_and_source_scoped_minimum"
  },
  "qualityGateRefs": [
    {
      "humanOwner": null,
      "parameterProfile": "seed.citation-traceability",
      "registryId": "source.traceability",
      "reviewMandate": null,
      "seedGate": "citation_traceability"
    },
    {
      "humanOwner": null,
      "parameterProfile": "seed.method-transparency",
      "registryId": "workflow.completeness",
      "reviewMandate": null,
      "seedGate": "method_transparency"
    },
    {
      "humanOwner": null,
      "parameterProfile": "seed.literature-balance",
      "registryId": "source.quality",
      "reviewMandate": null,
      "seedGate": "literature_balance"
    },
    {
      "humanOwner": null,
      "parameterProfile": "seed.limitation-disclosure",
      "registryId": "risk.disclosure",
      "reviewMandate": null,
      "seedGate": "limitation_disclosure"
    },
    {
      "humanOwner": null,
      "parameterProfile": "core.default",
      "registryId": "schema.valid",
      "reviewMandate": null,
      "seedGate": "core:schema.valid"
    },
    {
      "humanOwner": null,
      "parameterProfile": "core.default",
      "registryId": "input.required",
      "reviewMandate": null,
      "seedGate": "core:input.required"
    },
    {
      "humanOwner": null,
      "parameterProfile": "core.default",
      "registryId": "artifact.openability",
      "reviewMandate": null,
      "seedGate": "core:artifact.openability"
    },
    {
      "humanOwner": null,
      "parameterProfile": "core.default",
      "registryId": "delivery-manifest.integrity",
      "reviewMandate": null,
      "seedGate": "core:delivery-manifest.integrity"
    },
    {
      "humanOwner": null,
      "parameterProfile": "core.default",
      "registryId": "scope.lock",
      "reviewMandate": null,
      "seedGate": "core:scope.lock"
    },
    {
      "humanOwner": null,
      "parameterProfile": "core.default",
      "registryId": "external-action.authorized",
      "reviewMandate": null,
      "seedGate": "core:external-action.authorized"
    },
    {
      "humanOwner": null,
      "parameterProfile": "core.default",
      "registryId": "encoding.valid",
      "reviewMandate": null,
      "seedGate": "core:encoding.valid"
    }
  ],
  "requiredInputs": [
    {
      "id": "audience",
      "required": true,
      "sensitivity": "standard"
    },
    {
      "id": "citation_style",
      "required": true,
      "sensitivity": "standard"
    },
    {
      "id": "claim_boundary",
      "required": true,
      "sensitivity": "standard"
    },
    {
      "id": "goal",
      "required": true,
      "sensitivity": "standard"
    },
    {
      "id": "materials",
      "required": true,
      "sensitivity": "user_provided"
    },
    {
      "id": "research_question",
      "required": true,
      "sensitivity": "standard"
    }
  ],
  "rights": {
    "clearanceRequired": true,
    "unknownRightsAction": "human_review"
  },
  "sceneId": "academic-monograph",
  "schemaVersion": "1.0.0",
  "triggers": [
    {
      "id": "academic-monograph-trigger-1",
      "signal": "literature review",
      "weight": 1
    },
    {
      "id": "academic-monograph-trigger-2",
      "signal": "academic monograph",
      "weight": 0.9
    },
    {
      "id": "academic-monograph-trigger-3",
      "signal": "学术专著",
      "weight": 0.8
    }
  ],
  "workflowStages": [
    {
      "exitGateRefs": [
        "input.required"
      ],
      "id": "activate-materials",
      "operationModes": [
        "material_activation"
      ]
    },
    {
      "exitGateRefs": [
        "input.required",
        "schema.valid"
      ],
      "id": "transcribe-source",
      "operationModes": [
        "source_transcription"
      ]
    },
    {
      "exitGateRefs": [
        "schema.valid"
      ],
      "id": "plan-project",
      "operationModes": [
        "project_planning"
      ]
    },
    {
      "exitGateRefs": [
        "artifact.openability",
        "delivery-manifest.integrity"
      ],
      "id": "draft-and-revise",
      "operationModes": [
        "chapter_generation",
        "continuation",
        "bounded_revision"
      ]
    },
    {
      "exitGateRefs": [
        "artifact.openability",
        "delivery-manifest.integrity",
        "encoding.valid",
        "external-action.authorized",
        "input.required",
        "risk.disclosure",
        "schema.valid",
        "scope.lock",
        "source.quality",
        "source.traceability",
        "workflow.completeness"
      ],
      "id": "review-and-close",
      "operationModes": [
        "review_quality",
        "finished_draft_closure",
        "export_delivery",
        "asset_repurposing"
      ]
    }
  ]
}
