{
  "artifactRefs": [
    {
      "archetypeId": "primary-document",
      "artifactId": "annual_chronicle"
    },
    {
      "archetypeId": "structured-index",
      "artifactId": "event_index"
    },
    {
      "archetypeId": "appendix",
      "artifactId": "metric_appendix"
    },
    {
      "archetypeId": "risk-gap-report",
      "artifactId": "late_or_missing_items"
    }
  ],
  "capabilityBindings": [
    {
      "capabilityIds": [
        "capability-preflight",
        "material-activation",
        "multimodal-normalizer"
      ],
      "operationMode": "material_activation"
    },
    {
      "capabilityIds": [
        "scene-router",
        "scene-composer",
        "chapter-planning-expansion",
        "project-control"
      ],
      "operationMode": "project_planning"
    },
    {
      "capabilityIds": [
        "chapter-planning-expansion",
        "source-ledger-claim-graph",
        "voice-profile-humanizer",
        "project-control"
      ],
      "operationMode": "chapter_generation"
    },
    {
      "capabilityIds": [
        "continuation-recovery",
        "entity-timeline-continuity",
        "project-control"
      ],
      "operationMode": "continuation"
    },
    {
      "capabilityIds": [
        "scope-lock-diff",
        "entity-timeline-continuity"
      ],
      "operationMode": "bounded_revision"
    },
    {
      "capabilityIds": [
        "review-revise-quality-loop",
        "rights-privacy-consent",
        "research-verification",
        "transcription-adjudication",
        "review-briefing"
      ],
      "operationMode": "review_quality"
    },
    {
      "capabilityIds": [
        "review-revise-quality-loop",
        "multi-format-rendering",
        "review-briefing",
        "project-control"
      ],
      "operationMode": "finished_draft_closure"
    },
    {
      "capabilityIds": [
        "multi-format-rendering",
        "rights-privacy-consent",
        "artifact-derivation"
      ],
      "operationMode": "export_delivery"
    },
    {
      "capabilityIds": [
        "asset-repurposing",
        "media-illustration-planning",
        "artifact-derivation"
      ],
      "operationMode": "asset_repurposing"
    },
    {
      "capabilityIds": [
        "capability-preflight",
        "source-transcription",
        "multimodal-normalizer"
      ],
      "operationMode": "source_transcription"
    }
  ],
  "contentRiskClass": "medium",
  "displayName": "年鉴与年度大事记",
  "domainObjects": [
    "annual_freeze",
    "event",
    "metric",
    "unit",
    "year"
  ],
  "fallback": {
    "allowGeneralSubstitution": false,
    "connectorUnavailableBehavior": "preserve_route_and_use_local_workflow",
    "localOfflineAvailable": true,
    "riskFloor": "medium"
  },
  "family": "legacy_humanities",
  "fixtureRefs": [
    "evals/fixtures/scenes/annual-chronicle/normal.json",
    "evals/fixtures/scenes/annual-chronicle/missing.json",
    "evals/fixtures/scenes/annual-chronicle/conflicting.json",
    "evals/fixtures/scenes/annual-chronicle/unauthorized.json",
    "evals/fixtures/scenes/annual-chronicle/adversarial.json",
    "evals/fixtures/scenes/annual-chronicle/connector-unavailable.json"
  ],
  "implementationCheckpoint": "C13",
  "kind": "vertical_scene",
  "legacyAliases": [],
  "lifecycle": "implemented",
  "migrationProvenance": {
    "mappingVersion": "1.0.0",
    "seedCatalogSha256": "638f3f8e8f3ab7f1c2080018233ef6d7e19340187926571aad2eaf818eca82f4"
  },
  "operationModes": [
    "material_activation",
    "project_planning",
    "chapter_generation",
    "continuation",
    "bounded_revision",
    "review_quality",
    "finished_draft_closure",
    "export_delivery",
    "asset_repurposing",
    "source_transcription"
  ],
  "optionalPortBindings": [
    {
      "approvalRequired": true,
      "fallback": "local_workflow_without_connector",
      "legacyLabel": "recurring_collection",
      "minimumDataScope": "scene_scoped_minimum",
      "operation": "append_intake_submission",
      "portId": "StructuredIntakePort",
      "purpose": "optional enhancement for recurring_collection",
      "readbackRequired": true,
      "required": false,
      "writeMode": "external_write"
    },
    {
      "approvalRequired": true,
      "fallback": "local_workflow_without_connector",
      "legacyLabel": "unit_submission_table",
      "minimumDataScope": "scene_scoped_minimum",
      "operation": "append_intake_submission",
      "portId": "StructuredIntakePort",
      "purpose": "optional enhancement for unit_submission_table",
      "readbackRequired": true,
      "required": false,
      "writeMode": "external_write"
    },
    {
      "approvalRequired": true,
      "fallback": "local_workflow_without_connector",
      "legacyLabel": "annual_signoff",
      "minimumDataScope": "scene_scoped_minimum",
      "operation": "request_review",
      "portId": "ReviewPort",
      "purpose": "optional enhancement for annual_signoff",
      "readbackRequired": true,
      "required": false,
      "writeMode": "external_write"
    }
  ],
  "privacy": {
    "livingPersonReview": false,
    "minimumDataScope": "people_and_archive_scoped_minimum"
  },
  "qualityGateRefs": [
    {
      "humanOwner": null,
      "parameterProfile": "seed.coverage-period-closed",
      "registryId": "temporal.validity",
      "reviewMandate": null,
      "seedGate": "coverage_period_closed"
    },
    {
      "humanOwner": null,
      "parameterProfile": "seed.duplicate-event-control",
      "registryId": "entity.identity-consistency",
      "reviewMandate": null,
      "seedGate": "duplicate_event_control"
    },
    {
      "humanOwner": null,
      "parameterProfile": "seed.metric-definition-consistency",
      "registryId": "numeric-unit.consistency",
      "reviewMandate": null,
      "seedGate": "metric_definition_consistency"
    },
    {
      "humanOwner": null,
      "parameterProfile": "seed.late-entry-policy",
      "registryId": "temporal.validity",
      "reviewMandate": null,
      "seedGate": "late_entry_policy"
    },
    {
      "humanOwner": null,
      "parameterProfile": "core.default",
      "registryId": "schema.valid",
      "reviewMandate": null,
      "seedGate": "core:schema.valid"
    },
    {
      "humanOwner": null,
      "parameterProfile": "core.default",
      "registryId": "input.required",
      "reviewMandate": null,
      "seedGate": "core:input.required"
    },
    {
      "humanOwner": null,
      "parameterProfile": "core.default",
      "registryId": "artifact.openability",
      "reviewMandate": null,
      "seedGate": "core:artifact.openability"
    },
    {
      "humanOwner": null,
      "parameterProfile": "core.default",
      "registryId": "delivery-manifest.integrity",
      "reviewMandate": null,
      "seedGate": "core:delivery-manifest.integrity"
    },
    {
      "humanOwner": null,
      "parameterProfile": "core.default",
      "registryId": "scope.lock",
      "reviewMandate": null,
      "seedGate": "core:scope.lock"
    },
    {
      "humanOwner": null,
      "parameterProfile": "core.default",
      "registryId": "external-action.authorized",
      "reviewMandate": null,
      "seedGate": "core:external-action.authorized"
    },
    {
      "humanOwner": null,
      "parameterProfile": "core.default",
      "registryId": "encoding.valid",
      "reviewMandate": null,
      "seedGate": "core:encoding.valid"
    }
  ],
  "requiredInputs": [
    {
      "id": "audience",
      "required": true,
      "sensitivity": "standard"
    },
    {
      "id": "coverage_period",
      "required": true,
      "sensitivity": "standard"
    },
    {
      "id": "goal",
      "required": true,
      "sensitivity": "standard"
    },
    {
      "id": "late_entry_policy",
      "required": true,
      "sensitivity": "standard"
    },
    {
      "id": "materials",
      "required": true,
      "sensitivity": "user_provided"
    },
    {
      "id": "time_boundary",
      "required": true,
      "sensitivity": "standard"
    }
  ],
  "rights": {
    "clearanceRequired": false,
    "unknownRightsAction": "warn"
  },
  "sceneId": "annual-chronicle",
  "schemaVersion": "1.0.0",
  "triggers": [
    {
      "id": "annual-chronicle-trigger-1",
      "signal": "annual chronicle",
      "weight": 1
    },
    {
      "id": "annual-chronicle-trigger-2",
      "signal": "yearbook",
      "weight": 0.9
    },
    {
      "id": "annual-chronicle-trigger-3",
      "signal": "年度大事记",
      "weight": 0.8
    }
  ],
  "workflowStages": [
    {
      "exitGateRefs": [
        "input.required"
      ],
      "id": "activate-materials",
      "operationModes": [
        "material_activation"
      ]
    },
    {
      "exitGateRefs": [
        "input.required",
        "schema.valid"
      ],
      "id": "transcribe-source",
      "operationModes": [
        "source_transcription"
      ]
    },
    {
      "exitGateRefs": [
        "schema.valid"
      ],
      "id": "plan-project",
      "operationModes": [
        "project_planning"
      ]
    },
    {
      "exitGateRefs": [
        "artifact.openability",
        "delivery-manifest.integrity"
      ],
      "id": "draft-and-revise",
      "operationModes": [
        "chapter_generation",
        "continuation",
        "bounded_revision"
      ]
    },
    {
      "exitGateRefs": [
        "artifact.openability",
        "delivery-manifest.integrity",
        "encoding.valid",
        "entity.identity-consistency",
        "external-action.authorized",
        "input.required",
        "numeric-unit.consistency",
        "schema.valid",
        "scope.lock",
        "temporal.validity"
      ],
      "id": "review-and-close",
      "operationModes": [
        "review_quality",
        "finished_draft_closure",
        "export_delivery",
        "asset_repurposing"
      ]
    }
  ]
}
