{
  "artifactRefs": [
    {
      "archetypeId": "primary-document",
      "artifactId": "casebook"
    },
    {
      "archetypeId": "matrix",
      "artifactId": "case_matrix"
    },
    {
      "archetypeId": "structured-index",
      "artifactId": "lesson_index"
    },
    {
      "archetypeId": "risk-gap-report",
      "artifactId": "permission_and_anonymization_report"
    }
  ],
  "capabilityBindings": [
    {
      "capabilityIds": [
        "capability-preflight",
        "material-activation",
        "multimodal-normalizer"
      ],
      "operationMode": "material_activation"
    },
    {
      "capabilityIds": [
        "scene-router",
        "scene-composer",
        "chapter-planning-expansion",
        "project-control"
      ],
      "operationMode": "project_planning"
    },
    {
      "capabilityIds": [
        "chapter-planning-expansion",
        "source-ledger-claim-graph",
        "voice-profile-humanizer",
        "project-control"
      ],
      "operationMode": "chapter_generation"
    },
    {
      "capabilityIds": [
        "continuation-recovery",
        "entity-timeline-continuity",
        "project-control"
      ],
      "operationMode": "continuation"
    },
    {
      "capabilityIds": [
        "scope-lock-diff",
        "entity-timeline-continuity"
      ],
      "operationMode": "bounded_revision"
    },
    {
      "capabilityIds": [
        "review-revise-quality-loop",
        "rights-privacy-consent",
        "research-verification",
        "transcription-adjudication",
        "review-briefing"
      ],
      "operationMode": "review_quality"
    },
    {
      "capabilityIds": [
        "review-revise-quality-loop",
        "multi-format-rendering",
        "review-briefing",
        "project-control"
      ],
      "operationMode": "finished_draft_closure"
    },
    {
      "capabilityIds": [
        "multi-format-rendering",
        "rights-privacy-consent",
        "artifact-derivation"
      ],
      "operationMode": "export_delivery"
    },
    {
      "capabilityIds": [
        "asset-repurposing",
        "media-illustration-planning",
        "artifact-derivation"
      ],
      "operationMode": "asset_repurposing"
    },
    {
      "capabilityIds": [
        "capability-preflight",
        "source-transcription",
        "multimodal-normalizer"
      ],
      "operationMode": "source_transcription"
    }
  ],
  "contentRiskClass": "high",
  "displayName": "案例集与项目复盘集",
  "domainObjects": [
    "case",
    "context",
    "decision",
    "lesson",
    "result"
  ],
  "fallback": {
    "allowGeneralSubstitution": false,
    "connectorUnavailableBehavior": "preserve_route_and_use_local_workflow",
    "localOfflineAvailable": true,
    "riskFloor": "high"
  },
  "family": "knowledge_publishing",
  "fixtureRefs": [
    "evals/fixtures/scenes/casebook/normal.json",
    "evals/fixtures/scenes/casebook/missing.json",
    "evals/fixtures/scenes/casebook/conflicting.json",
    "evals/fixtures/scenes/casebook/unauthorized.json",
    "evals/fixtures/scenes/casebook/adversarial.json",
    "evals/fixtures/scenes/casebook/connector-unavailable.json"
  ],
  "implementationCheckpoint": "C13",
  "kind": "vertical_scene",
  "legacyAliases": [],
  "lifecycle": "implemented",
  "migrationProvenance": {
    "mappingVersion": "1.0.0",
    "seedCatalogSha256": "638f3f8e8f3ab7f1c2080018233ef6d7e19340187926571aad2eaf818eca82f4"
  },
  "operationModes": [
    "material_activation",
    "project_planning",
    "chapter_generation",
    "continuation",
    "bounded_revision",
    "review_quality",
    "finished_draft_closure",
    "export_delivery",
    "asset_repurposing",
    "source_transcription"
  ],
  "optionalPortBindings": [
    {
      "approvalRequired": true,
      "fallback": "local_workflow_without_connector",
      "legacyLabel": "case_intake_form",
      "minimumDataScope": "scene_scoped_minimum",
      "operation": "append_intake_submission",
      "portId": "StructuredIntakePort",
      "purpose": "optional enhancement for case_intake_form",
      "readbackRequired": true,
      "required": false,
      "writeMode": "external_write"
    },
    {
      "approvalRequired": true,
      "fallback": "local_workflow_without_connector",
      "legacyLabel": "owner_approval",
      "minimumDataScope": "scene_scoped_minimum",
      "operation": "request_review",
      "portId": "ReviewPort",
      "purpose": "optional enhancement for owner_approval",
      "readbackRequired": true,
      "required": false,
      "writeMode": "external_write"
    },
    {
      "approvalRequired": true,
      "fallback": "local_workflow_without_connector",
      "legacyLabel": "evidence_archive",
      "minimumDataScope": "scene_scoped_minimum",
      "operation": "store_artifact",
      "portId": "DeliveryPort",
      "purpose": "optional enhancement for evidence_archive",
      "readbackRequired": true,
      "required": false,
      "writeMode": "external_write"
    }
  ],
  "privacy": {
    "livingPersonReview": false,
    "minimumDataScope": "claim_and_source_scoped_minimum"
  },
  "qualityGateRefs": [
    {
      "humanOwner": null,
      "parameterProfile": "seed.case-permission",
      "registryId": "rights.clearance",
      "reviewMandate": null,
      "seedGate": "case_permission"
    },
    {
      "humanOwner": null,
      "parameterProfile": "seed.result-attribution",
      "registryId": "source.traceability",
      "reviewMandate": null,
      "seedGate": "result_attribution"
    },
    {
      "humanOwner": null,
      "parameterProfile": "seed.anonymization",
      "registryId": "privacy.anonymization",
      "reviewMandate": null,
      "seedGate": "anonymization"
    },
    {
      "humanOwner": null,
      "parameterProfile": "seed.cross-case-comparability",
      "registryId": "projection.parity",
      "reviewMandate": null,
      "seedGate": "cross_case_comparability"
    },
    {
      "humanOwner": null,
      "parameterProfile": "core.default",
      "registryId": "schema.valid",
      "reviewMandate": null,
      "seedGate": "core:schema.valid"
    },
    {
      "humanOwner": null,
      "parameterProfile": "core.default",
      "registryId": "input.required",
      "reviewMandate": null,
      "seedGate": "core:input.required"
    },
    {
      "humanOwner": null,
      "parameterProfile": "core.default",
      "registryId": "artifact.openability",
      "reviewMandate": null,
      "seedGate": "core:artifact.openability"
    },
    {
      "humanOwner": null,
      "parameterProfile": "core.default",
      "registryId": "delivery-manifest.integrity",
      "reviewMandate": null,
      "seedGate": "core:delivery-manifest.integrity"
    },
    {
      "humanOwner": null,
      "parameterProfile": "core.default",
      "registryId": "scope.lock",
      "reviewMandate": null,
      "seedGate": "core:scope.lock"
    },
    {
      "humanOwner": null,
      "parameterProfile": "core.default",
      "registryId": "external-action.authorized",
      "reviewMandate": null,
      "seedGate": "core:external-action.authorized"
    },
    {
      "humanOwner": null,
      "parameterProfile": "core.default",
      "registryId": "encoding.valid",
      "reviewMandate": null,
      "seedGate": "core:encoding.valid"
    }
  ],
  "requiredInputs": [
    {
      "id": "audience",
      "required": true,
      "sensitivity": "standard"
    },
    {
      "id": "case_selection_rule",
      "required": true,
      "sensitivity": "standard"
    },
    {
      "id": "claim_boundary",
      "required": true,
      "sensitivity": "standard"
    },
    {
      "id": "comparison_dimensions",
      "required": true,
      "sensitivity": "standard"
    },
    {
      "id": "goal",
      "required": true,
      "sensitivity": "standard"
    },
    {
      "id": "materials",
      "required": true,
      "sensitivity": "user_provided"
    }
  ],
  "rights": {
    "clearanceRequired": true,
    "unknownRightsAction": "human_review"
  },
  "sceneId": "casebook",
  "schemaVersion": "1.0.0",
  "triggers": [
    {
      "id": "casebook-trigger-1",
      "signal": "casebook",
      "weight": 1
    },
    {
      "id": "casebook-trigger-2",
      "signal": "project retrospective collection",
      "weight": 0.9
    },
    {
      "id": "casebook-trigger-3",
      "signal": "案例复盘集",
      "weight": 0.8
    }
  ],
  "workflowStages": [
    {
      "exitGateRefs": [
        "input.required"
      ],
      "id": "activate-materials",
      "operationModes": [
        "material_activation"
      ]
    },
    {
      "exitGateRefs": [
        "input.required",
        "schema.valid"
      ],
      "id": "transcribe-source",
      "operationModes": [
        "source_transcription"
      ]
    },
    {
      "exitGateRefs": [
        "schema.valid"
      ],
      "id": "plan-project",
      "operationModes": [
        "project_planning"
      ]
    },
    {
      "exitGateRefs": [
        "artifact.openability",
        "delivery-manifest.integrity"
      ],
      "id": "draft-and-revise",
      "operationModes": [
        "chapter_generation",
        "continuation",
        "bounded_revision"
      ]
    },
    {
      "exitGateRefs": [
        "artifact.openability",
        "delivery-manifest.integrity",
        "encoding.valid",
        "external-action.authorized",
        "input.required",
        "privacy.anonymization",
        "projection.parity",
        "rights.clearance",
        "schema.valid",
        "scope.lock",
        "source.traceability"
      ],
      "id": "review-and-close",
      "operationModes": [
        "review_quality",
        "finished_draft_closure",
        "export_delivery",
        "asset_repurposing"
      ]
    }
  ]
}
