{
  "artifactRefs": [
    {
      "archetypeId": "primary-document",
      "artifactId": "brand_story_master"
    },
    {
      "archetypeId": "structured-index",
      "artifactId": "fact_sheet"
    },
    {
      "archetypeId": "primary-document",
      "artifactId": "voice_guide"
    },
    {
      "archetypeId": "action-plan",
      "artifactId": "repurposing_plan"
    }
  ],
  "capabilityBindings": [
    {
      "capabilityIds": [
        "capability-preflight",
        "material-activation",
        "multimodal-normalizer"
      ],
      "operationMode": "material_activation"
    },
    {
      "capabilityIds": [
        "scene-router",
        "scene-composer",
        "chapter-planning-expansion",
        "project-control"
      ],
      "operationMode": "project_planning"
    },
    {
      "capabilityIds": [
        "chapter-planning-expansion",
        "source-ledger-claim-graph",
        "voice-profile-humanizer",
        "project-control"
      ],
      "operationMode": "chapter_generation"
    },
    {
      "capabilityIds": [
        "continuation-recovery",
        "entity-timeline-continuity",
        "project-control"
      ],
      "operationMode": "continuation"
    },
    {
      "capabilityIds": [
        "scope-lock-diff",
        "entity-timeline-continuity"
      ],
      "operationMode": "bounded_revision"
    },
    {
      "capabilityIds": [
        "review-revise-quality-loop",
        "rights-privacy-consent",
        "research-verification",
        "transcription-adjudication",
        "review-briefing"
      ],
      "operationMode": "review_quality"
    },
    {
      "capabilityIds": [
        "review-revise-quality-loop",
        "multi-format-rendering",
        "review-briefing",
        "project-control"
      ],
      "operationMode": "finished_draft_closure"
    },
    {
      "capabilityIds": [
        "multi-format-rendering",
        "rights-privacy-consent",
        "artifact-derivation"
      ],
      "operationMode": "export_delivery"
    },
    {
      "capabilityIds": [
        "capability-preflight",
        "source-transcription",
        "multimodal-normalizer"
      ],
      "operationMode": "source_transcription"
    }
  ],
  "contentRiskClass": "medium",
  "displayName": "品牌与创始人深度故事",
  "domainObjects": [
    "audience",
    "brand_claim",
    "founder_event",
    "narrative_tension",
    "proof"
  ],
  "fallback": {
    "allowGeneralSubstitution": false,
    "connectorUnavailableBehavior": "preserve_route_and_use_local_workflow",
    "localOfflineAvailable": true,
    "riskFloor": "medium"
  },
  "family": "content_restricted",
  "fixtureRefs": [
    "evals/fixtures/scenes/brand-story-longform/normal.json",
    "evals/fixtures/scenes/brand-story-longform/missing.json",
    "evals/fixtures/scenes/brand-story-longform/conflicting.json",
    "evals/fixtures/scenes/brand-story-longform/unauthorized.json",
    "evals/fixtures/scenes/brand-story-longform/adversarial.json",
    "evals/fixtures/scenes/brand-story-longform/connector-unavailable.json"
  ],
  "implementationCheckpoint": "C13",
  "kind": "vertical_scene",
  "legacyAliases": [
    "ghostwriter"
  ],
  "lifecycle": "implemented",
  "migrationProvenance": {
    "mappingVersion": "1.0.0",
    "seedCatalogSha256": "638f3f8e8f3ab7f1c2080018233ef6d7e19340187926571aad2eaf818eca82f4"
  },
  "operationModes": [
    "material_activation",
    "project_planning",
    "chapter_generation",
    "continuation",
    "bounded_revision",
    "review_quality",
    "finished_draft_closure",
    "export_delivery",
    "source_transcription"
  ],
  "optionalPortBindings": [
    {
      "approvalRequired": true,
      "fallback": "local_workflow_without_connector",
      "legacyLabel": "interview_collection",
      "minimumDataScope": "scene_scoped_minimum",
      "operation": "append_intake_submission",
      "portId": "StructuredIntakePort",
      "purpose": "optional enhancement for interview_collection",
      "readbackRequired": true,
      "required": false,
      "writeMode": "external_write"
    },
    {
      "approvalRequired": true,
      "fallback": "local_workflow_without_connector",
      "legacyLabel": "brand_review",
      "minimumDataScope": "scene_scoped_minimum",
      "operation": "request_review",
      "portId": "ReviewPort",
      "purpose": "optional enhancement for brand_review",
      "readbackRequired": true,
      "required": false,
      "writeMode": "external_write"
    },
    {
      "approvalRequired": true,
      "fallback": "local_workflow_without_connector",
      "legacyLabel": "distribution_tasks",
      "minimumDataScope": "scene_scoped_minimum",
      "operation": "create_task",
      "portId": "CollaborationPort",
      "purpose": "optional enhancement for distribution_tasks",
      "readbackRequired": true,
      "required": false,
      "writeMode": "external_write"
    }
  ],
  "privacy": {
    "livingPersonReview": false,
    "minimumDataScope": "restricted_source_scoped_minimum"
  },
  "qualityGateRefs": [
    {
      "humanOwner": null,
      "parameterProfile": "seed.claim-proof",
      "registryId": "claim.support",
      "reviewMandate": null,
      "seedGate": "claim_proof"
    },
    {
      "humanOwner": null,
      "parameterProfile": "seed.voice-consistency",
      "registryId": "voice.fidelity",
      "reviewMandate": null,
      "seedGate": "voice_consistency"
    },
    {
      "humanOwner": null,
      "parameterProfile": "seed.reputation-risk",
      "registryId": "risk.disclosure",
      "reviewMandate": null,
      "seedGate": "reputation_risk"
    },
    {
      "humanOwner": null,
      "parameterProfile": "seed.marketing-fact-separation",
      "registryId": "claim.fact-inference-separation",
      "reviewMandate": null,
      "seedGate": "marketing_fact_separation"
    },
    {
      "humanOwner": null,
      "parameterProfile": "core.default",
      "registryId": "schema.valid",
      "reviewMandate": null,
      "seedGate": "core:schema.valid"
    },
    {
      "humanOwner": null,
      "parameterProfile": "core.default",
      "registryId": "input.required",
      "reviewMandate": null,
      "seedGate": "core:input.required"
    },
    {
      "humanOwner": null,
      "parameterProfile": "core.default",
      "registryId": "artifact.openability",
      "reviewMandate": null,
      "seedGate": "core:artifact.openability"
    },
    {
      "humanOwner": null,
      "parameterProfile": "core.default",
      "registryId": "delivery-manifest.integrity",
      "reviewMandate": null,
      "seedGate": "core:delivery-manifest.integrity"
    },
    {
      "humanOwner": null,
      "parameterProfile": "core.default",
      "registryId": "scope.lock",
      "reviewMandate": null,
      "seedGate": "core:scope.lock"
    },
    {
      "humanOwner": null,
      "parameterProfile": "core.default",
      "registryId": "external-action.authorized",
      "reviewMandate": null,
      "seedGate": "core:external-action.authorized"
    },
    {
      "humanOwner": null,
      "parameterProfile": "core.default",
      "registryId": "encoding.valid",
      "reviewMandate": null,
      "seedGate": "core:encoding.valid"
    }
  ],
  "requiredInputs": [
    {
      "id": "audience",
      "required": true,
      "sensitivity": "standard"
    },
    {
      "id": "brand_fact_sheet",
      "required": true,
      "sensitivity": "internal"
    },
    {
      "id": "goal",
      "required": true,
      "sensitivity": "standard"
    },
    {
      "id": "marketing_claim_boundary",
      "required": true,
      "sensitivity": "standard"
    },
    {
      "id": "materials",
      "required": true,
      "sensitivity": "user_provided"
    },
    {
      "id": "publication_boundary",
      "required": true,
      "sensitivity": "standard"
    },
    {
      "id": "review_owner",
      "required": true,
      "sensitivity": "standard"
    }
  ],
  "rights": {
    "clearanceRequired": false,
    "unknownRightsAction": "warn"
  },
  "sceneId": "brand-story-longform",
  "schemaVersion": "1.0.0",
  "triggers": [
    {
      "id": "brand-story-longform-trigger-1",
      "signal": "founder story",
      "weight": 1
    },
    {
      "id": "brand-story-longform-trigger-2",
      "signal": "brand longform",
      "weight": 0.9
    },
    {
      "id": "brand-story-longform-trigger-3",
      "signal": "品牌故事",
      "weight": 0.8
    }
  ],
  "workflowStages": [
    {
      "exitGateRefs": [
        "input.required"
      ],
      "id": "activate-materials",
      "operationModes": [
        "material_activation"
      ]
    },
    {
      "exitGateRefs": [
        "input.required",
        "schema.valid"
      ],
      "id": "transcribe-source",
      "operationModes": [
        "source_transcription"
      ]
    },
    {
      "exitGateRefs": [
        "schema.valid"
      ],
      "id": "plan-project",
      "operationModes": [
        "project_planning"
      ]
    },
    {
      "exitGateRefs": [
        "artifact.openability",
        "claim.fact-inference-separation"
      ],
      "id": "draft-and-revise",
      "operationModes": [
        "chapter_generation",
        "continuation",
        "bounded_revision"
      ]
    },
    {
      "exitGateRefs": [
        "artifact.openability",
        "claim.fact-inference-separation",
        "claim.support",
        "delivery-manifest.integrity",
        "encoding.valid",
        "external-action.authorized",
        "input.required",
        "risk.disclosure",
        "schema.valid",
        "scope.lock",
        "voice.fidelity"
      ],
      "id": "review-and-close",
      "operationModes": [
        "review_quality",
        "finished_draft_closure",
        "export_delivery"
      ]
    }
  ]
}
